,title,author_name,title_link,date
407,Financial Contagion from US to African Frontier Markets during the 2007-2009 Global Financial Crisis,"Jaliyyah Ahmadu-Bello, Timothy Rodgers",https://pureportal.coventry.ac.uk/en/publications/financial-contagion-from-us-to-african-frontier-markets-during-th,2016
408,"Financial Innovation, Banking System and Housing Market. Is the Concept of Financial Innovation Enough to Explain the Banks’ Regulatory Arbitrage?","Eliana Lauretta, Marco Raberto, Andrea Mazzocchetti",https://pureportal.coventry.ac.uk/en/publications/financial-innovation-banking-system-and-housing-market-is-the-con,2016
409,"Financial openness, risk and bank efficiency: Cross-country evidence","Yun Luo, Sailesh Tanna, Glauco De Vita",https://pureportal.coventry.ac.uk/en/publications/financial-openness-risk-and-bank-efficiency-cross-country-evidenc-2,Jun 2016
410,Handbook of Frontier Markets: Evidence from Asia and International Comparative Studies,"Panagiotis Andrikopoulos (Editor), G. N. Gregoriou (Editor), V. Kallinterakis (Editor)",https://pureportal.coventry.ac.uk/en/publications/handbook-of-frontier-markets-evidence-from-asia-and-international,12 Aug 2016
411,"Handbook of Frontier Markets: African, European and Asian Evidence","Panagiotis Andrikopoulos (Editor), Greg N. Gregoriou (Editor), Vasileios Kallinterakis (Editor)",https://pureportal.coventry.ac.uk/en/publications/handbook-of-frontier-markets-african-european-and-asian-evidence,2016
412,ICT as a general-purpose technology: The productivity of ICT in the United States revisited,"Hailin Liao, B. Wang, B. Li, T. Weyman-Jones",https://pureportal.coventry.ac.uk/en/publications/ict-as-a-general-purpose-technology-the-productivity-of-ict-in-th-2,Sep 2016
413,"IFRS Adoption in the EU and the Challenge of Nomenclature Evidence from the UK, France, and Germany","M. Nnadi, Sailesh Tanna",https://pureportal.coventry.ac.uk/en/publications/ifrs-adoption-in-the-eu-and-the-challenge-of-nomenclature-evidenc-2,Mar 2016
414,Information asymmetry and financial development dynamics in Africa,"S. A. Asongu, Jacinta C. Nwachukwu, V. S. Tchamyou",https://pureportal.coventry.ac.uk/en/publications/information-asymmetry-and-financial-development-dynamics-in-afric-2,22 Dec 2016
415,International Standards on Auditing in the International Financial Services Centres: What Matters?,"Pran Boolaky, Kamil Omoteso",https://pureportal.coventry.ac.uk/en/publications/international-standards-on-auditing-in-the-international-financia-2,2016
416,Islamic financial reporting standardisation projects: institutional logics perspective on the Malaysian case,Ahmad Abras,https://pureportal.coventry.ac.uk/en/publications/islamic-financial-reporting-standardisation-projects-institutiona,2016
417,Is there a Mission Drift in Microfinance? Some New Empirical Evidence from Uganda,Francis Darko,https://pureportal.coventry.ac.uk/en/publications/is-there-a-mission-drift-in-microfinance-some-new-empirical-evide,Mar 2016
418,"Law, Politics, and the Quality of Government in Africa","S.A. Asongu, Jacinta C. Nwachukwu",https://pureportal.coventry.ac.uk/en/publications/law-politics-and-the-quality-of-government-in-africa-2,12 Oct 2016
419,Missing discourse in global supply chain management: the notion of exploitation and role of the state,"Shahidul Islam, Shaila Ahmed",https://pureportal.coventry.ac.uk/en/publications/missing-discourse-in-global-supply-chain-management-the-notion-of,2016
420,"Mobile phone penetration, mobile banking and inclusive development in africa","S. A. Asongu, Jacinta C. Nwachukwu",https://pureportal.coventry.ac.uk/en/publications/mobile-phone-penetration-mobile-banking-and-inclusive-development-2,Jan 2016
421,Mobile phones in the diffusion of knowledge and persistence in inclusive human development in Sub-Saharan Africa,"Simplice Asongu, Jacinta Nwachukwu",https://pureportal.coventry.ac.uk/en/publications/mobile-phones-in-the-diffusion-of-knowledge-and-persistence-in-in-2,21 Jun 2016
422,On the real effects of financial pressure: Evidence from euro area firm-level employment during the recent financial crisis,"Filipa Fernandes, Serafeim Tsoukas, Alexandros Kontonikas",https://pureportal.coventry.ac.uk/en/publications/on-the-real-effects-of-financial-pressure-evidence-from-euro-area,2016
423,Revolution empirics: predicting the Arab Spring,"Simplice A. Asongu, J. Nwachukwu",https://pureportal.coventry.ac.uk/en/publications/revolution-empirics-predicting-the-arab-spring-2,Sep 2016
424,Risk Management in Islamic Banks,Kenneth Baldwin,https://pureportal.coventry.ac.uk/en/publications/risk-management-in-islamic-banks-2,2016
425,Signalling and Lifecycle Theories in the Banking Sectors of GCC Frontier Markets: An Empirical Assessment,"Ibrahim Yousef, Sudip Patra, Sailesh Tanna",https://pureportal.coventry.ac.uk/en/publications/signalling-and-lifecycle-theories-in-the-banking-sectors-of-gcc-f-2,24 Aug 2016
426,"Structural Breaks, Efficiency and Volatility: An Empirical Investigation of Southeast Asian Frontier Markets","P. Andrikopoulos, A.D. Le Trang, M. Newaz",https://pureportal.coventry.ac.uk/en/publications/structural-breaks-efficiency-and-volatility-an-empirical-investig-2,2016
427,Student performance in e-education: how far do learning style differences influence student grades?,Timothy Rodgers,https://pureportal.coventry.ac.uk/en/publications/student-performance-in-e-education-how-far-do-learning-style-diff-2,2016
428,The Comparative Inclusive Human Development of Globalisation in Africa,"S.A. Asongu, Jacinta Nwachukwu",https://pureportal.coventry.ac.uk/en/publications/the-comparative-inclusive-human-development-of-globalisation-in-a-2,Dec 2016
429,The Cost of Multiple Large Shareholders,"C. X. Cai, D. Hillier, Jun Wang",https://pureportal.coventry.ac.uk/en/publications/the-cost-of-multiple-large-shareholders-2,1 Sep 2016
430,The Estimation of Minimum Efficient Scale of the Port Industry,"Y.-J. Seo, Jin Suk Park",https://pureportal.coventry.ac.uk/en/publications/the-estimation-of-minimum-efficient-scale-of-the-port-industry-2,Jul 2016
431,The governance-performance relationship: evidence from Ghana,"Andrews Owusu, C. Weir",https://pureportal.coventry.ac.uk/en/publications/the-governance-performance-relationship-evidence-from-ghana-2,12 Sep 2016
432,The impact of seaports on the regional economies in South Korea: Panel evidence from the augmented Solow model,"Jin Suk Park, Y-J. Seo",https://pureportal.coventry.ac.uk/en/publications/the-impact-of-seaports-on-the-regional-economies-in-south-korea-p-2,Jan 2016
433,The Market Reaction to secondary listings: Evidence from selected companies listed on the Johannesburg Stock exchange.,"Irfaan Omarjee, Tasneem Joosub, David Coldwell",https://pureportal.coventry.ac.uk/en/publications/the-market-reaction-to-secondary-listings-evidence-from-selected-,Dec 2016
434,The Mobile Phone in the Diffusion of Knowledge for Institutional Quality in Sub-Saharan Africa,"S.A. Asongu, Jacinta C. Nwachukwu",https://pureportal.coventry.ac.uk/en/publications/the-mobile-phone-in-the-diffusion-of-knowledge-for-institutional--2,Oct 2016
435,The philosophy of research on financial inclusion,Nikhil Sapre,https://pureportal.coventry.ac.uk/en/publications/the-philosophy-of-research-on-financial-inclusion-2,28 Mar 2016
436,The Portfolio Diversification Benefits of Frontier Markets: An Investigation Into Regional Effects,"Panos Andrikopoulos, Jacek Niklewski, Timothy Rodgers",https://pureportal.coventry.ac.uk/en/publications/the-portfolio-diversification-benefits-of-frontier-markets-an-inv-2,2016
437,The role of governance in mobile phones for inclusive human development in Sub-Saharan Africa,"S. A. Asongu, Jacinta C. Nwachukwu",https://pureportal.coventry.ac.uk/en/publications/the-role-of-governance-in-mobile-phones-for-inclusive-human-devel-2,Sep 2016
438,Twitter and the US stock market: The influence of micro‑bloggers on share prices,"Karl Shutes, K. McGrath, Piotr Lis, Robert Riegler",https://pureportal.coventry.ac.uk/en/publications/twitter-and-the-us-stock-market-the-influence-of-microbloggers-on-2,2016
439,UK consumers’ perceived risk of buying products from emerging economies: A moderated mediation model,"Weiyue Wang, Hongwei He, Sunil Sahadev, Wei Song",https://pureportal.coventry.ac.uk/en/publications/uk-consumers-perceived-risk-of-buying-products-from-emerging-econ,2016
440,Value-enhancing learning from industry-wide diversification experience,"Thang Nguyen, Charlie X. Cai",https://pureportal.coventry.ac.uk/en/publications/value-enhancing-learning-from-industry-wide-diversification-exper,3 Apr 2016
441,"Welfare spending and quality of growth in developing countries: A note on evidence from Hopefuls, Contenders and Best Performers","S.A. Asongu, Jacinta C. Nwachukwu",https://pureportal.coventry.ac.uk/en/publications/welfare-spending-and-quality-of-growth-in-developing-countries-a--2,Dec 2016
442,What drives corporate governance quality in emerging African economies? Evidence from Ghana,Andrews Owusu,https://pureportal.coventry.ac.uk/en/publications/what-drives-corporate-governance-quality-in-emerging-african-econ-4,2016
443,What Drives Corporate Governance Quality in Emerging African Economies? Evidence from Ghana - Conference Paper,Andrews Owusu,https://pureportal.coventry.ac.uk/en/publications/what-drives-corporate-governance-quality-in-emerging-african-econ-3,2016
444,Accounting for corporate environmental responsibility in emerging economies: The case study of Nigeria,Abdurafiu Noah,https://pureportal.coventry.ac.uk/en/publications/accounting-for-corporate-environmental-responsibility-in-emerging-2,23 Mar 2015
445,A Finance-led Economic System: An ABM Experimentation and Policy Proposals,"Eliana Lauretta, Marco Raberto",https://pureportal.coventry.ac.uk/en/publications/a-finance-led-economic-system-an-abm-experimentation-and-policy-p,2015
446,ARIMA modelling of Lithuanian house price index,"A. Jadevicius, S. Huston",https://pureportal.coventry.ac.uk/en/publications/arima-modelling-of-lithuanian-house-price-index,2 Mar 2015
447,Board leadership structure for Chinese public listed companies,"Mei Yu, J.K. Ashton",https://pureportal.coventry.ac.uk/en/publications/board-leadership-structure-for-chinese-public-listed-companies-2,Jul 2015
448,Bohemianism and urban regeneration: A structured literature review and compte rendu,"Simon Huston, David Wadley, Rachael Fitzpatrick",https://pureportal.coventry.ac.uk/en/publications/bohemianism-and-urban-regeneration-a-structured-literature-review,1 Aug 2015
449,Capitalisation: reflections and practice for project appraisal,"Simon Huston, A. Jadevicius",https://pureportal.coventry.ac.uk/en/publications/capitalisation-reflections-and-practice-for-project-appraisal-an-,2015
450,Challenges Faced by Takaful Initiatives in the UK – The Salaam Insurance Experience,Aqsa Aziz,https://pureportal.coventry.ac.uk/en/publications/challenges-faced-by-takaful-initiatives-in-the-uk-the-salaam-insu,2015
451,Competitiveness and Determinants of Bank Profitability in Sub-Saharan Africa,Isaiah Oino,https://pureportal.coventry.ac.uk/en/publications/competitiveness-and-determinants-of-bank-profitability-in-sub-sah,25 Jun 2015
452,Compound Interest/Return,Lien Luu,https://pureportal.coventry.ac.uk/en/publications/compound-interestreturn,30 Apr 2015
453,Corporate Governance in China: Uncertainty Rules,"Mark Holmes, Renfred Wong",https://pureportal.coventry.ac.uk/en/publications/corporate-governance-in-china-uncertainty-rules,13 Jul 2015
454,Corporate social responsibility reporting practices in banking companies in Bangladesh: Impact of Regulatory Changes,"Hafij Ullah, Mohammad Afjalur Rahman",https://pureportal.coventry.ac.uk/en/publications/corporate-social-responsibility-reporting-practices-in-banking-co,10 Apr 2015
455,Does compliance matter in surveillance of Nigerian banks? A critical examination of the Central Bank of Nigeria code of corporate governance,"S. R. Abdullahi, Mas’ud Usman Ibrahim",https://pureportal.coventry.ac.uk/en/publications/does-compliance-matter-in-surveillance-of-nigerian-banks-a-critic-2,2015
456,Does Regulatory Environment affect Earnings Management in Transitional Economies? An Empirical Examination of the Financial Reporting Quality of Cross-Listed Firms of China and Hong Kong,"Matthias Nnadi, Kamil Omoteso, Yi Yu",https://pureportal.coventry.ac.uk/en/publications/does-regulatory-environment-affect-earnings-management-in-transit-2,2015
457,Effects of Exchange Rate Volatility on Tourist Flows into Iceland,"G. Agiomirgianakis, Dimitris Serenis, N. Tsounis",https://pureportal.coventry.ac.uk/en/publications/effects-of-exchange-rate-volatility-on-tourist-flows-into-iceland-2,9 Oct 2015
458,"Fatality Sensitivity in Coalition Countries: A Study of British, Polish and Australian Public Opinion on the Iraq War",Piotr Lis,https://pureportal.coventry.ac.uk/en/publications/fatality-sensitivity-in-coalition-countries-a-study-of-british-po,31 Jan 2015
459,Finance-Growth: Virtuous and Dis-Virtuous Cycles (VDCs) Theory and Empirical Evidence,"Eliana Lauretta, Jane Binner, Logan Kelly, Sajid Chaudhry",https://pureportal.coventry.ac.uk/en/publications/finance-growth-virtuous-and-dis-virtuous-cycles-vdcs-theory-and-e,2015
460,Financial decisions and market performance: An analysis of China's domestic mergers and acquisitions,"Christopher Muganhu, Jia Liu",https://pureportal.coventry.ac.uk/en/publications/financial-decisions-and-market-performance-an-analysis-of-chinas-,2015
461,Fluctuations in the Exchange Rate and Aggregate Exports in Ukraine,"G. Agiomirgianakis, Dimitris Serenis, N. Tsounis",https://pureportal.coventry.ac.uk/en/publications/fluctuations-in-the-exchange-rate-and-aggregate-exports-in-ukrain,2015
462,Forecasting the Jordanian stock index: modelling asymmetric volatility and distribution effects within a GARCH framework,"H. Al-Hajieh, H. AlNemer, Timothy Rodgers, Jacek Niklewski",https://pureportal.coventry.ac.uk/en/publications/forecasting-the-jordanian-stock-index-modelling-asymmetric-volati-2,2015
463,Foreign aid and governance in Africa,"S. Asongu, J. Nwachukwu",https://pureportal.coventry.ac.uk/en/publications/foreign-aid-and-governance-in-africa-2,2015
464,Impact of corporate governance on firm risk,Qazi Awais Amin,https://pureportal.coventry.ac.uk/en/publications/impact-of-corporate-governance-on-firm-risk,2015
465,Industry concentration and the cross-section of stock returns: Evidence from the UK,"Larry Su, Nawar Hashem",https://pureportal.coventry.ac.uk/en/publications/industry-concentration-and-the-cross-section-of-stock-returns-evi,Sep 2015
466,Introduction to accounting: The double-entry bookkeeping system & a case study ,"Alessio Faccia, Francesco Manni",https://pureportal.coventry.ac.uk/en/publications/introduction-to-accounting-the-double-entry-bookkeeping-system-am,1 Dec 2015
467,Market reaction to the positiveness of annual report narratives,"Liafisu Sina Yekini, Tomasz Piotr Wisniewski, Yuval Millo",https://pureportal.coventry.ac.uk/en/publications/market-reaction-to-the-positiveness-of-annual-report-narratives-2,11 Dec 2015
468,Microfinance and Poverty Reduction: The Case Study of Selected Institutions in the Greater Accra Region of Ghana,Francis Darko,https://pureportal.coventry.ac.uk/en/publications/microfinance-and-poverty-reduction-the-case-study-of-selected-ins,2015
469,Monetary and debt-concerned fiscal policies interaction in monetary unions,Pasquale Foresti,https://pureportal.coventry.ac.uk/en/publications/monetary-and-debt-concerned-fiscal-policies-interaction-in-moneta,Oct 2015
470,Mortgage,Lien Luu,https://pureportal.coventry.ac.uk/en/publications/mortgage,Apr 2015
471,"Organizational customer orientation, employee customer orientation and employee job performance: the moderating role of openness to experience","Weiyue Wang, H. He, W. Zhu, Wei Song",https://pureportal.coventry.ac.uk/en/publications/organizational-customer-orientation-employee-customer-orientation-2,2015
472,Paraconsistent games and the limits of rational self-interest,"A. Daynes, Panos Andrikopoulos, P. Pagas, D. Latimer",https://pureportal.coventry.ac.uk/en/publications/paraconsistent-games-and-the-limits-of-rational-self-interest-2,4 Jan 2015
473,"Personalisation of power, neoliberalism and the production of corruption","Amal Hayati Ahmad Khair, Roszaini Haniffa, Mohammad Hudaib, Mohamad Nazri Mohamad",https://pureportal.coventry.ac.uk/en/publications/personalisation-of-power-neoliberalism-and-the-production-of-corr,1 Sep 2015
474,Real Estate,Lien Luu,https://pureportal.coventry.ac.uk/en/publications/real-estate,Apr 2015
475,Reestablishing stability and avoiding a credit crunch: Comparing different bad bank schemes,"Achim Hauck, Ulrike Neyer, Thomas Vieten",https://pureportal.coventry.ac.uk/en/publications/reestablishing-stability-and-avoiding-a-credit-crunch-comparing-d,Aug 2015
476,Re-Examining the Financial Deepening-Growth Nexus: A Time-Series Evidence of the Nigerian Economy from 1961 to 2013,Ejike Udeogu,https://pureportal.coventry.ac.uk/en/publications/re-examining-the-financial-deepening-growth-nexus-a-time-series-e,2015
477,Retirement,Lien Luu,https://pureportal.coventry.ac.uk/en/publications/retirement,Apr 2015
478,"'Smart' sustainable urban regeneration: Institutions, quality and financial innovation","Simon Huston, Reyhaneh Rahimzad, Ali Parsa",https://pureportal.coventry.ac.uk/en/publications/smart-sustainable-urban-regeneration-institutions-quality-and-fin,Nov 2015
479,Stock market returns and the content of annual report narratives,"T.P. Wisniewski, Sina Yekini",https://pureportal.coventry.ac.uk/en/publications/stock-market-returns-and-the-content-of-annual-report-narratives-2,2015
480,Telling it straight — Mark Carney splits opinion,Tola Adesina,https://pureportal.coventry.ac.uk/en/publications/telling-it-straight-mark-carney-splits-opinion,18 Dec 2015
481,Testing the Weak-form Efficiency of Stock Markets: A Comparative Study of Emerging and Industrialised Economies,"Jacinta Nwachukwu, Shitta Omowunmi",https://pureportal.coventry.ac.uk/en/publications/testing-the-weak-form-efficiency-of-stock-markets-a-comparative-s,2015
482,The consequences of a refund in threshold public good games,"E. Cartwright, A. Stepanova",https://pureportal.coventry.ac.uk/en/publications/the-consequences-of-a-refund-in-threshold-public-good-games,Sep 2015
483,The Corporate Social Responsibility of Accounting Firms: A Comparison Study between China and South Africa,"Tasneem Joosub, Xin Guo",https://pureportal.coventry.ac.uk/en/publications/the-corporate-social-responsibility-of-accounting-firms-a-compari,2015
484,The credit signals that matter most for sovereign bond spreads with split rating,"Huong Vu, Rasha Alsakka, Owain ap Gwilym",https://pureportal.coventry.ac.uk/en/publications/the-credit-signals-that-matter-most-for-sovereign-bond-spreads-wi,May 2015
485,The duration analysis of structural breaks: is stability destabilizing?,Jin Suk Park,https://pureportal.coventry.ac.uk/en/publications/the-duration-analysis-of-structural-breaks-is-stability-destabili-2,2015
486,The economy wide impact of HIV/AIDS and the funding dilemma in Africa: Evidence from a dynamic life cycle horizon of Uganda,"Judith Kabajulizi, Mthuli Ncube",https://pureportal.coventry.ac.uk/en/publications/the-economy-wide-impact-of-hivaids-and-the-funding-dilemma-in-afr,Sep 2015
487,"The effects of exchange rate volatility on sectoral exports evidence from Sweden, UK, and Germany","G. Agiomirgianakis, Dimitria Serenis, N. Tsounis",https://pureportal.coventry.ac.uk/en/publications/the-effects-of-exchange-rate-volatility-on-sectoral-exports-evide-2,2015
488,The Effects of Exchange Rate Volatility On Tourist Flows: Evidence From The UK And Sweden,"G. Agiomirgianakis, Dimitris Serenis, N. Tsounis",https://pureportal.coventry.ac.uk/en/publications/the-effects-of-exchange-rate-volatility-on-tourist-flows-evidence-2,2015
489,The impact of profitability on capital structure and speed of adjustment: An empirical examination of selected firms in Nigerian Stock Exchange,"Isaiah Oino, Ben Ukaegbu",https://pureportal.coventry.ac.uk/en/publications/the-impact-of-profitability-on-capital-structure-and-speed-of-adj,30 Sep 2015
490,The Incremental Effect of Education on Corruption: Evidence of Synergy from Lifelong Learning,"S.A. Asongu, J. Nwachukwu",https://pureportal.coventry.ac.uk/en/publications/the-incremental-effect-of-education-on-corruption-evidence-of-syn-2,2015
491,The late 1970s to 1980s: Economic Problems and the United States,Lien Luu,https://pureportal.coventry.ac.uk/en/publications/the-late-1970s-to-1980s-economic-problems-and-the-united-states,Apr 2015
492,The Management of Refinancing Risk in Islamic Banks,Kenneth Baldwin,https://pureportal.coventry.ac.uk/en/publications/the-management-of-refinancing-risk-in-islamic-banks-2,17 Aug 2015
493,Time Varying Correlation between Islamic Equity and Commodity Returns: Implications for Portfolio Diversification,"Sarkar Kabir, Aftab Khan, Omar Bashar, Mansur Masih",https://pureportal.coventry.ac.uk/en/publications/time-varying-correlation-between-islamic-equity-and-commodity-ret,2015
494,Accounting for corporate environmental (CER) in emerging economies: The case study of Nigeria,Abdurafiu Noah,https://pureportal.coventry.ac.uk/en/publications/accounting-for-corporate-environmental-cer-in-emerging-economies-,14 Apr 2014
495,A model of the Eurosystem's operational framework and the euro overnight interbank market,"Achim Hauck, Ulrike Neyer",https://pureportal.coventry.ac.uk/en/publications/a-model-of-the-eurosystems-operational-framework-and-the-euro-ove,1 Jun 2014
496,Are Islamic Equity Indices More Efficient Than Their Conventional Counterparts? Evidence From Major Global Index Families,"Sarkar Kabir, Abdelbari Khamlichi, Mohamed Arouri, Frederic Teulon",https://pureportal.coventry.ac.uk/en/publications/are-islamic-equity-indices-more-efficient-than-their-conventional,30 Jun 2014
497,"Bank capital regulation, loan contracts, and corporate investment","Achim Hauck, Diemo Dietrich",https://pureportal.coventry.ac.uk/en/publications/bank-capital-regulation-loan-contracts-and-corporate-investment,1 May 2014
498,Business Case for Corporate Social Responsibility In Emerging Economies? An Exploratory Empirical Study of The South African Business Context.,"David Coldwell, Tasneem Joosub",https://pureportal.coventry.ac.uk/en/publications/business-case-for-corporate-social-responsibility-in-emerging-eco,2014
499,Can FDI be a Panacea for Unemployment? The Turkish Case,"Mehtap Hisarciklilar, Derya Gültekin-Karakaş, Ahmet A. Asici",https://pureportal.coventry.ac.uk/en/publications/can-fdi-be-a-panacea-for-unemployment-the-turkish-case,6 Mar 2014
500,Corporate governance: Brazilian specifics,Renfred Wong,https://pureportal.coventry.ac.uk/en/publications/corporate-governance-brazilian-specifics,2014
501,Detecting Asset Misappropriation: A Framework for External Auditors,Rasha Kassem,https://pureportal.coventry.ac.uk/en/publications/detecting-asset-misappropriation-a-framework-for-external-auditor,2014
502,Disagreement between rating agencies and bond opacity: A theoretical perspective,"Achim Hauck, Ulrike Neyer",https://pureportal.coventry.ac.uk/en/publications/disagreement-between-rating-agencies-and-bond-opacity-a-theoretic,1 Apr 2014
503,Does Exchange Rate Variation Effect African Trade Flows?,"Dimitrios Serenis, N. Tsounis",https://pureportal.coventry.ac.uk/en/publications/does-exchange-rate-variation-effect-african-trade-flows-2,6 Nov 2014
504,Does Mood Explain the Monday Effect?,"Azizah Abu Bakar, Antonios Siganos, Evangelos Vagenas-Nanos",https://pureportal.coventry.ac.uk/en/publications/does-mood-explain-the-monday-effect,Sep 2014
505,Effects of Changing Weather Patterns on the Trade of Major Food Crops,"Jeff Powell, Karl Shutes, Andzei Tabeau",https://pureportal.coventry.ac.uk/en/publications/effects-of-changing-weather-patterns-on-the-trade-of-major-food-c,2014
506,"Employee Productivity, Employment Growth, and the Cross‐Border Acquisitions by Emerging Market Firms","Ali Ataullah, Hang Le, Amandeep Sahota",https://pureportal.coventry.ac.uk/en/publications/employee-productivity-employment-growth-and-the-crossborder-acqui,31 Jul 2014
507,Environmental Regulation and Location of Industrialized Agricultural Production in Europe,"Abay Mulatu, A. Wossink",https://pureportal.coventry.ac.uk/en/publications/environmental-regulation-and-location-of-industrialized-agricultu-2,1 Aug 2014
508,Exchange Rate Volatility and Aggregate Exports: Evidence from Two Small Countries,"Dimitris Serenis, N. Tsounis",https://pureportal.coventry.ac.uk/en/publications/exchange-rate-volatility-and-aggregate-exports-evidence-from-two--2,2014
509,Exchange Rate Volatility and Tourist Flows into Turkey,"G. Agiomirgianakis, Dimitris Serenis, N. Tsounis",https://pureportal.coventry.ac.uk/en/publications/exchange-rate-volatility-and-tourist-flows-into-turkey-2,1 Dec 2014
510,Expansionary Fiscal Consolidations: Theoretical Underpinnings and their Implications for the Eurozone,"Pasquale Foresti, Ugo Marani",https://pureportal.coventry.ac.uk/en/publications/expansionary-fiscal-consolidations-theoretical-underpinnings-and-,2 Jun 2014
511,Finance and Growth: Modern Interpretations of the Thoughts of Schumpeter,Eliana Lauretta,https://pureportal.coventry.ac.uk/en/publications/finance-and-growth-modern-interpretations-of-the-thoughts-of-schu,2014
512,How do Heterogeneous Beliefs drive the Cross-Section of Stock Return Volatilities and Correlations and Turnover Volatilities,"Nam Dau, Paul Ehling , Heyerdahl Larsen ",https://pureportal.coventry.ac.uk/en/publications/how-do-heterogeneous-beliefs-drive-the-cross-section-of-stock-ret,2014
513,Identifying Causes for the Failure of Salaam Halal Insurance,Aqsa Aziz,https://pureportal.coventry.ac.uk/en/publications/identifying-causes-for-the-failure-of-salaam-halal-insurance,2014
