,title,author_name,title_link,date
300,The development of accounting practices and the adoption of IFRS in selected MENA countries,"Pran Boolaky, Kamil Omoteso, Masud Ibrahim, Ismail Adelopo",https://pureportal.coventry.ac.uk/en/publications/the-development-of-accounting-practices-and-the-adoption-of-ifrs-,2018
301,The Economic Effects of Supply Chain Management on the Automobile Industries in China,Hafiz Ubaid Ur Rahman Rahmani,https://pureportal.coventry.ac.uk/en/publications/the-economic-effects-of-supply-chain-management-on-the-automobile,25 Nov 2018
302,The Impact of Armed Conflict and Terrorism on Foreign Aid: a Sector-Level Analysis,Piotr Lis,https://pureportal.coventry.ac.uk/en/publications/the-impact-of-armed-conflict-and-terrorism-on-foreign-aid-a-secto,Oct 2018
303,The Impact of the 2007-09 and Euro-Zone Crises on Natural Resources Sector Beta in African Emerging Markets: The Impact of the 2007-09 and Euro-Zone Crises on Natural Resources Sector Beta in African Emerging Markets,"Uchenna Tony-Okeke, Jaliyyah Ahmadu-Bello, Jacek Niklewski, Timothy Rodgers",https://pureportal.coventry.ac.uk/en/publications/the-impact-of-the-2007-09-and-euro-zone-crises-on-natural-resourc,1 Oct 2018
304,The macroeconomic implications of public healthcare financing: a computable general equilibrium analysis of Uganda,"Judith Kabajulizi, Marcus Keogh-Brown, Richard Smith",https://pureportal.coventry.ac.uk/en/publications/the-macroeconomic-implications-of-public-healthcare-financing-a-c,15 Jun 2018
305,The relative importance of trade verses FDI-led economic growth in Thailand,"Sailesh Tanna, Kitja Topaiboul, Chengchun Li",https://pureportal.coventry.ac.uk/en/publications/the-relative-importance-of-trade-verses-fdi-led-economic-growth-i,1 Jan 2018
306,The role of external debt in the foreign direct investment-growth relationship,"Sailesh Tanna, Chengchun Li, Glauco De Vita",https://pureportal.coventry.ac.uk/en/publications/the-role-of-external-debt-in-the-foreign-direct-investment-growth,12 Oct 2018
307,The role of foreign direct investment in less developed countries,"Chengchun Li, Sailesh Tanna",https://pureportal.coventry.ac.uk/en/publications/the-role-of-foreign-direct-investment-in-less-developed-countries,1 Jan 2018
308,The role of seaports in regional employment: evidence from South Korea,"Jin Suk Park, Young-Joon Seo",https://pureportal.coventry.ac.uk/en/publications/the-role-of-seaports-in-regional-employment-evidence-from-south-k-2,2018
309,Time Preference for Investment in the Environment: The Impact of Intrinsic Motivation,"Lory Barile, John Cullis, Philip Jones",https://pureportal.coventry.ac.uk/en/publications/time-preference-for-investment-in-the-environment-the-impact-of-i,1 Sep 2018
310,Two centuries of farmland prices in England,"A. Jadevicius, S. Huston, A. Baum, A. Butler",https://pureportal.coventry.ac.uk/en/publications/two-centuries-of-farmland-prices-in-england,2018
311,Two-stage DEA-Truncated Regression: Application in Banking Efficiency and Financial Development,"Filipa Da Silva Fernandes, Charalampos Stasinakis, V. Bardarova",https://pureportal.coventry.ac.uk/en/publications/two-stage-dea-truncated-regression-application-in-banking-efficie,15 Apr 2018
312,UK Consumers’ Perceived Risk of Buying Products from Emerging Economies: A Moderated Mediation Model,"Weiyue Wang, Hongwei He, Sunil Sahadev, Wei Song",https://pureportal.coventry.ac.uk/en/publications/uk-consumers-perceived-risk-of-buying-products-from-emerging-econ-2,May 2018
313,Whether Shari’ah compliance efficiency is a matter for the financial performance: The case of Islami Bank Bangladesh Limited,"Hafij Ullah, Ruma Khanam",https://pureportal.coventry.ac.uk/en/publications/whether-shariah-compliance-efficiency-is-a-matter-for-the-financi,4 Mar 2018
314,‘Individual Failure’ and a Behavioural Public Sector Economics,"Lory Barile, John Cullis, Philip Jones",https://pureportal.coventry.ac.uk/en/publications/individual-failure-and-a-behavioural-public-sector-economics,Feb 2018
315,Accountability of Transnational Corporations in the Developing World: The Case for an Enforceable International Mechanism,"Kamil Omoteso, H.O. Yusuf",https://pureportal.coventry.ac.uk/en/publications/accountability-of-transnational-corporations-in-the-developing-wo-2,28 Feb 2017
316,Accounting analyses of momentum and contrarian strategies in emerging markets,"M. Nnadi, Sailesh Tanna",https://pureportal.coventry.ac.uk/en/publications/accounting-analyses-of-momentum-and-contrarian-strategies-in-emer-2,30 Jan 2017
317,Accounting for the Environment: Accountability in the Nigerian cement industry,Abdurafiu Noah,https://pureportal.coventry.ac.uk/en/publications/accounting-for-the-environment-accountability-in-the-nigerian-cem,27 Jan 2017
318,"Accounting Standards Complexity, Audit Fees and Financial Analyst Forecasts in Australia",Muhammad Shahin Miah,https://pureportal.coventry.ac.uk/en/publications/accounting-standards-complexity-audit-fees-and-financial-analyst-,24 Nov 2017
319,A distance learning university and its economic impact in a country’s peripheries: the case of Hellenic Open University,"G. Agiomirgianakis, Dimitrios Serenis, N. Tsounis",https://pureportal.coventry.ac.uk/en/publications/a-distance-learning-university-and-its-economic-impact-in-a-count-2,2017
320,Aggregate and Disaggregate Financial Repression and Financial Liberalization Index and Database in China,"Qiaoyuan Lin, Xin Wu, Ali Tasiran",https://pureportal.coventry.ac.uk/en/publications/aggregate-and-disaggregate-financial-repression-and-financial-lib,2017
321,A literature survey on proposed african monetary unions,"S. Asongu, Jacinta Nwachukwu, V. Tchamyou",https://pureportal.coventry.ac.uk/en/publications/a-literature-survey-on-proposed-african-monetary-unions-2,Jul 2017
322,An extra 7 years before I’m debt free: The effect of the poverty premium on debt advice service users,"Xia Lin, Hannah Bennett, Ursula Santos, Nikhil Sapre, Shane Randall, Chloe Brown",https://pureportal.coventry.ac.uk/en/publications/an-extra-7-years-before-im-debt-free-the-effect-of-the-poverty-pr,2017
323,Are serial acquirers good targets for acquisition? An accounting perspective,"Matthias Nnadi, Saliesh Tanna",https://pureportal.coventry.ac.uk/en/publications/are-serial-acquirers-good-targets-for-acquisition-an-accounting-p-2,4 Jan 2017
324,A Summary of a Survey on Proposed African Monetary Unions,"Simplice Asongu, Vanessa S Tchamyou, Jacinta Nwachukwu",https://pureportal.coventry.ac.uk/en/publications/a-summary-of-a-survey-on-proposed-african-monetary-unions,Jun 2017
325,At What Levels of Financial Development Does Information Sharing Matter?,"Simplice A. Asongu, Jacinta Nwachukwu",https://pureportal.coventry.ac.uk/en/publications/at-what-levels-of-financial-development-does-information-sharing-,2 Jun 2017
326,Audit firm tenure regulations and financial reporting quality: Evidence from the UK,Shahidul Islam,https://pureportal.coventry.ac.uk/en/publications/audit-firm-tenure-regulations-and-financial-reporting-quality-evi,2017
327,"Beliefs, Portfolio Constraints, Speculation and Asset Pricing",Nam Dau,https://pureportal.coventry.ac.uk/en/publications/beliefs-portfolio-constraints-speculation-and-asset-pricing,2017
328,BIM-based deconstruction tool: Towards essential functionalities,"O.O. Akinade, L.O. Oyedele, Kamil Omoteso, S.O. Ajayi, M. Bilal, H.A. Owolabi, H.A. Alaka, L. Ayris, J.H. Looney",https://pureportal.coventry.ac.uk/en/publications/bim-based-deconstruction-tool-towards-essential-functionalities-2,Jun 2017
329,Buying Friends? The Importance of Economic Flows in Assembling the Iraq War Coalition,"Robert Riegler, Piotr Lis, Mehtap Hisarciklilar",https://pureportal.coventry.ac.uk/en/publications/buying-friends-the-importance-of-economic-flows-in-assembling-the,20 Dec 2017
330,Can We Go beyond Agency Conceptions? Rethinking Agency Theory in Developing Countries,"Fatima Yusuf, Amna Yousaf",https://pureportal.coventry.ac.uk/en/publications/can-we-go-beyond-agency-conceptions-rethinking-agency-theory-in-d,9 May 2017
331,Central Bank Optimism as a Policy Tool: Evidence from the Bank of England,Tola Adesina,https://pureportal.coventry.ac.uk/en/publications/central-bank-optimism-as-a-policy-tool-evidence-from-the-bank-of-,Nov 2017
332,Comparative Evidence on the Value Relevance of IFRS-based Accounting Information in Germany and the UK,"A. E. Elbakry, Jacinta C. Nwachukwu, H. A. Abdou, T. Elshandidy",https://pureportal.coventry.ac.uk/en/publications/comparative-evidence-on-the-value-relevance-of-ifrs-based-account-2,2017
333,Conclusion,Simon Huston,https://pureportal.coventry.ac.uk/en/publications/conclusion-9,14 Sep 2017
334,Construction Firms’ Competitiveness,"Puying Li, Simon Huston, Ali Parsa",https://pureportal.coventry.ac.uk/en/publications/construction-firms-competitiveness,14 Sep 2017
335,Corporate governance and bidder returns: Evidence from China's domestic mergers and acquisitions,"Christopher Muganhu, Jia Liu",https://pureportal.coventry.ac.uk/en/publications/corporate-governance-and-bidder-returns-evidence-from-chinas-dome,2017
336,Culture clash – National vs international publishing,"Hiba Massoud, Rami Ayoubi",https://pureportal.coventry.ac.uk/en/publications/culture-clash-national-vs-international-publishing,25 Aug 2017
337,Differences of opinion in sovereign credit signals during the European crisis,"Rasha Alsakka, Owain ap Gwilym, Huong Vu",https://pureportal.coventry.ac.uk/en/publications/differences-of-opinion-in-sovereign-credit-signals-during-the-eur-2,2017
338,Discharging environmental accountability in emerging economies: the case of the Nigerian cement industry,"Abdurafiu Noah, Pik  Liew, Pawan Adhikari",https://pureportal.coventry.ac.uk/en/publications/discharging-environmental-accountability-in-emerging-economies-th,8 Sep 2017
339,Diversifying away the risk of war and cross-border political crisis,"Ayman M.A. Omar, Tomasz Piotr Wisniewski, Sandra Nolte",https://pureportal.coventry.ac.uk/en/publications/diversifying-away-the-risk-of-war-and-cross-border-political-cris-2,May 2017
340,Does CSR Improve Financial Transparency? Evidence from China,"Prabhu Udawatte, Sangho Kim, Lyn Juelin",https://pureportal.coventry.ac.uk/en/publications/does-csr-improve-financial-transparency-evidence-from-china,2017
341,Earnings management in UK's mergers and acquisition,"Prabhu Udawatte, Saeed Akbar, Sang Ho Kim, Thiyagaraj Rangasamy",https://pureportal.coventry.ac.uk/en/publications/earnings-management-in-uks-mergers-and-acquisition,2017
342,Economic Analysis of Ransomware,"Julio Hernandez-Castro, Edward Cartwright, Anna Stepanova",https://pureportal.coventry.ac.uk/en/publications/economic-analysis-of-ransomware,20 Mar 2017
343,Effective timing of tourism policy: The case of Singapore,"G. Agiomirgianakis, Dimitrios Serenis, N. Tsounis",https://pureportal.coventry.ac.uk/en/publications/effective-timing-of-tourism-policy-the-case-of-singapore-2,Jan 2017
344,Efficiency in a forced contribution threshold public good game,"E. Cartwright, A. Stepanova",https://pureportal.coventry.ac.uk/en/publications/efficiency-in-a-forced-contribution-threshold-public-good-game,Nov 2017
345,Essential Personal Finance: A Practical Guide for Students,"Lien Luu, Jonquil Lowe, Jason Butler, Tony Byrne",https://pureportal.coventry.ac.uk/en/publications/essential-personal-finance-a-practical-guide-for-students,10 Mar 2017
346,Estimating volatility persistence under a Brexit-vote structural break,Tola Adesina,https://pureportal.coventry.ac.uk/en/publications/estimating-volatility-persistence-under-a-brexit-vote-structural-,Nov 2017
347,Exploring External Auditors Perceptions of the Motivations behind Management Fraud in Egypt: A Mixed Research Methods Approach,Rasha Kassem,https://pureportal.coventry.ac.uk/en/publications/exploring-external-auditors-perceptions-of-the-motivations-behind,12 Dec 2017
348,Fighting Capital Flight in Africa: Evidence from Bundling and Unbundling Governance,"S. A. Asongu, Jacinta C. Nwachukwu",https://pureportal.coventry.ac.uk/en/publications/fighting-capital-flight-in-africa-evidence-from-bundling-and-unbu-2,Sep 2017
349,"Financial Innovation, Banking System and Housing Market.","Eliana Lauretta, Andrea Mazzocchetti, Marco Raberto, Silvano Cincotti",https://pureportal.coventry.ac.uk/en/publications/financial-innovation-banking-system-and-housing-market,2017
350,Financing HIV/AIDS responses in Africa: Impact evidence from Uganda,"Judith Kabajulizi, Mthuli Ncube",https://pureportal.coventry.ac.uk/en/publications/financing-hivaids-responses-in-africa-impact-evidence-from-uganda,4 Oct 2017
351,"Foreign Aid and Inclusive Development: Updated Evidence from Africa, 2005–2012","Simplice A. Asongu, Jacinta C. Nwachukwu",https://pureportal.coventry.ac.uk/en/publications/foreign-aid-and-inclusive-development-updated-evidence-from-afric-2,Mar 2017
352,"Fuel Exports, Aid and Terrorism","Simplice Asongu, Jacinta Nwachukwu",https://pureportal.coventry.ac.uk/en/publications/fuel-exports-aid-and-terrorism,2017
353,Global Diffusion of Anglo-American Governance: Evaluating Responses across Three Emerging Economies,"Fatima Yusuf, Geofry Areneke, Danson Kimani, Devendra Kodwani",https://pureportal.coventry.ac.uk/en/publications/global-diffusion-of-anglo-american-governance-evaluating-response,9 May 2017
354,Globalization and Inclusive Human Development in Africa,"Simplice Asongu, Jacinta Nwachukwu",https://pureportal.coventry.ac.uk/en/publications/globalization-and-inclusive-human-development-in-africa,27 Jun 2017
355,Hedging and speculative pressures and the transition of the spot-futures relationship in energy and metal markets,"Jin Suk Park, Y. Shi",https://pureportal.coventry.ac.uk/en/publications/hedging-and-speculative-pressures-and-the-transition-of-the-spot--4,1 Nov 2017
356,How long is UK property cycle?,"A. Jadevicius, S.H. Huston",https://pureportal.coventry.ac.uk/en/publications/how-long-is-uk-property-cycle,3 Jul 2017
357,Impact of non-audit services regulations on financial reporting quality: Latest evidence from the UK,Shahidul Islam,https://pureportal.coventry.ac.uk/en/publications/impact-of-non-audit-services-regulations-on-financial-reporting-q,2017
358,Intraday Herding on a Cross-Border Exchange,"Panos Andrikopoulos, Vasileios Kallinterakis, Mario Pedro Leite Ferreira, Thanos  Verousis",https://pureportal.coventry.ac.uk/en/publications/intraday-herding-on-a-cross-border-exchange,Oct 2017
359,Investor sentiment towards Corporate Announcement,"Prabhu Udawatte, Thiyagaraj Rangasamy",https://pureportal.coventry.ac.uk/en/publications/investor-sentiment-towards-corporate-announcement,17 Feb 2017
360,Islamic Finance Ethics and Perception of Western Consumers,Samir Alamad,https://pureportal.coventry.ac.uk/en/publications/islamic-finance-ethics-and-perception-of-western-consumers,13 Mar 2017
361,Is the Threat of Foreign Aid Withdrawal an Effective Deterrent to Political Oppression? Evidence from 53 African Countries,"Simplice Asongu, Jacinta Nwachukwu",https://pureportal.coventry.ac.uk/en/publications/is-the-threat-of-foreign-aid-withdrawal-an-effective-deterrent-to,8 Mar 2017
362,Learning by doing: Do economics students self-evaluation skills improve?,"Jon Guest, Robert Riegler",https://pureportal.coventry.ac.uk/en/publications/learning-by-doing-do-economics-students-self-evaluation-skills-im-2,Jan 2017
363,Managing Conflict of Interests in Professional Accounting Firms,Maria Ishaque,https://pureportal.coventry.ac.uk/en/publications/managing-conflict-of-interests-in-professional-accounting-firms,4 Oct 2017
364,"Megaproject Screening and Management: King’s Cross, Olympic Park and Nine Elms","Reyhaneh Rahimzad, Simon Huston, Ali Parsa",https://pureportal.coventry.ac.uk/en/publications/megaproject-screening-and-management-kings-cross-olympic-park-and,14 Sep 2017
365,Not all that Glitters is Gold: ICT and Inclusive Human Development in Sub-Saharan Africa,"Jacinta Nwachukwu, Simplice Asongu",https://pureportal.coventry.ac.uk/en/publications/not-all-that-glitters-is-gold-ict-and-inclusive-human-development,2017
366,Ownership Structure and the Choice of SEO Issue Method in the UK,"Panos Andrikopoulos, Ji  Sun, Jie  Guo",https://pureportal.coventry.ac.uk/en/publications/ownership-structure-and-the-choice-of-seo-issue-method-in-the-uk,2017
367,"Quality of Growth Empirics: Comparative Gaps, Benchmarking and Policy Syndromes","Simplice Asongu, Jacinta Nwachukwu",https://pureportal.coventry.ac.uk/en/publications/quality-of-growth-empirics-comparative-gaps-benchmarking-and-poli,2017
368,Reconsider a Currency Union in Asia,Wei Song,https://pureportal.coventry.ac.uk/en/publications/reconsider-a-currency-union-in-asia,2017
369,Risk return profiles of Islamic equities and commodity portfolios in different market conditions,"Sarkar Kabir, A. Mansur M. Masih, Obiyathulla Ismath Bacha",https://pureportal.coventry.ac.uk/en/publications/risk-return-profiles-of-islamic-equities-and-commodity-portfolios,2017
370,Short and Long-Run Determinates of Tourist Flows: The Case of South Korea,"G. Agiomirgianakis, Dimitris, Jim Serenis, N. Tsounis",https://pureportal.coventry.ac.uk/en/publications/short-and-long-run-determinates-of-tourist-flows-the-case-of-sout,2017
371,Smart Urban Planning,"Simon Huston, Arvydas Jadevicius, Savas Zafer Sahin",https://pureportal.coventry.ac.uk/en/publications/smart-urban-planning,14 Sep 2017
372,"Smart urban regeneration: Visions, institutions and mechanisms for real estate",Simon Huston,https://pureportal.coventry.ac.uk/en/publications/smart-urban-regeneration-visions-institutions-and-mechanisms-for-,14 Sep 2017
373,Special issue of the Review of Behavioral Finance guest editors’ introduction,"Panos Andrikopoulos,  Evangelos  Vagenas-Nanos",https://pureportal.coventry.ac.uk/en/publications/special-issue-of-the-review-of-behavioral-finance-guest-editors-i,5 Jun 2017
374,Stock Liquidity and SMEs’ Likelihood of Bankruptcy: Evidence from the US Market,"Izidin El kalak, Alcino Azevedo, Robert Hudson, Mohamad Nazri Abd Karim",https://pureportal.coventry.ac.uk/en/publications/stock-liquidity-and-smes-likelihood-of-bankruptcy-evidence-from-t,Dec 2017
375,Strategic Market Games and Ricardo,Waseem Toraubally,https://pureportal.coventry.ac.uk/en/publications/strategic-market-games-and-ricardo,19 Nov 2017
376,Sukuk and Bond: An Empirical Analysis with Characteristics Matching,"Sarkar Kabir, Sawkat Hossain , Hamid Uddin",https://pureportal.coventry.ac.uk/en/publications/sukuk-and-bond-an-empirical-analysis-with-characteristics-matchin,2017
377,Supply and demand sides of mobile payment: A comparative analysis of successful mobile payment adoption in developed and developing countries,"Chatchai Kongaut, Piotr Lis",https://pureportal.coventry.ac.uk/en/publications/supply-and-demand-sides-of-mobile-payment-a-comparative-analysis-,2017
378,Tenure and spending within UK households at the end of the recent recession,Jacinta C. Nwachukwu,https://pureportal.coventry.ac.uk/en/publications/tenure-and-spending-within-uk-households-at-the-end-of-the-recent-2,Sep 2017
379,The effects of Foreign Ownership and Chinese firms’ Earnings Management: Accrual-based and Real activity-based,"Prabhu Udawatte, Sang Ho Kim, Yohan  An",https://pureportal.coventry.ac.uk/en/publications/the-effects-of-foreign-ownership-and-chinese-firms-earnings-manag,2017
380,The impact of civil war on foreign direct investment flows to developing countries,"Chengchun Li, Syed Mansoob Murshed, Sailesh Tanna",https://pureportal.coventry.ac.uk/en/publications/the-impact-of-civil-war-on-foreign-direct-investment-flows-to-dev-2,2017
381,The Impact of Terrorism on Governance in African Countries,"Simplice Asongu, Jacinta Nwachukwu",https://pureportal.coventry.ac.uk/en/publications/the-impact-of-terrorism-on-governance-in-african-countries,Nov 2017
382,The Performance Consequences of Board Structure Changes: Evidence from Ghana,"Andrews Owusu, Mark Holmes, Jacob Agyemang",https://pureportal.coventry.ac.uk/en/publications/the-performance-consequences-of-board-structure-changes-evidence-,19 Dec 2017
383,The stability of money demand in the long-run: Italy 1861–2011,"Vittorio Daniele, Pasquale Foresti, Oreste Napolitano",https://pureportal.coventry.ac.uk/en/publications/the-stability-of-money-demand-in-the-long-run-italy-18612011,May 2017
384,The Structure of UK Outbound FDI And Environmental Regulation,Abay Mulatu,https://pureportal.coventry.ac.uk/en/publications/the-structure-of-uk-outbound-fdi-and-environmental-regulation,Sep 2017
385,The Synergy of Financial Sector Development and Information Sharing in Financial Access: Propositions and Empirical Evidence,"Simplice Asongu, Jacinta Nwachukwu",https://pureportal.coventry.ac.uk/en/publications/the-synergy-of-financial-sector-development-and-information-shari,Apr 2017
386,The welfare implications of public healthcare financing: A Macro-Micro simulation analysis of Uganda,"Judith Kabajulizi, Marcus Keogh-Brown, Richard Smith",https://pureportal.coventry.ac.uk/en/publications/the-welfare-implications-of-public-healthcare-financing-a-macro-m-2,Dec 2017
387,The welfare implications of public healthcare financing: A Macro-Micro simulation analysis of Uganda,"Judith Kabajulizi, Marcus Keogh-Brown, Richard Smith",https://pureportal.coventry.ac.uk/en/publications/the-welfare-implications-of-public-healthcare-financing-a-macro-m,30 Jun 2017
388,Understanding Islamic financial reporting standardisation projects: institutional logics perspective,Ahmad Abras,https://pureportal.coventry.ac.uk/en/publications/understanding-islamic-financial-reporting-standardisation-project,2017
389,Urban Conundrums,Simon Huston,https://pureportal.coventry.ac.uk/en/publications/urban-conundrums,14 Sep 2017
390,Valuation Systems: The case of Dubai,"Simon Huston, Ebraheim Ali Lahbash, Ali Parsa",https://pureportal.coventry.ac.uk/en/publications/valuation-systems-the-case-of-dubai,14 Sep 2017
391,What drives differences of opinion in sovereign ratings? The roles of information disclosure and political risk,"Huong Vu, Rasha Alsakka, Owain ap Gwilym",https://pureportal.coventry.ac.uk/en/publications/what-drives-differences-of-opinion-in-sovereign-ratings-the-roles,Jul 2017
392,What is the net effect of financial liberalization on bank productivity? A decomposition analysis of bank total factor productivity growth,"Sailesh Tanna, Yun Luo, Glauco De Vita",https://pureportal.coventry.ac.uk/en/publications/what-is-the-net-effect-of-financial-liberalization-on-bank-produc,Jul 2017
393,A Brief Future of Time in the Monopoly of Scientific Knowledge,"Simplice Asongu, Jacinta Nwachukwu",https://pureportal.coventry.ac.uk/en/publications/a-brief-future-of-time-in-the-monopoly-of-scientific-knowledge-2,Dec 2016
394,An Examination of the Fraud Triangle Model: Implications for External Auditors and Audit Regulators,"Rasha Kassem, Andrew Higson",https://pureportal.coventry.ac.uk/en/publications/an-examination-of-the-fraud-triangle-model-implications-for-exter,4 May 2016
395,Basic Mathematics for Economists,"Piotr Lis, Mike Rosser",https://pureportal.coventry.ac.uk/en/publications/basic-mathematics-for-economists,22 Mar 2016
396,Cash flow analysis and case studies,"Alessio Faccia, Francesco Manni",https://pureportal.coventry.ac.uk/en/publications/cash-flow-analysis-and-case-studies,30 Dec 2016
397,Combating Environmental Irresponsibility of TNCs in Africa: An Empirical Analysis,"Hakeem O. Yusuf, Kamil Omoteso",https://pureportal.coventry.ac.uk/en/publications/combating-environmental-irresponsibility-of-tncs-in-africa-an-emp-2,2016
398,"Conditional linkages between iron ore exports, foreign aid and terrorism","S. A. Asongu, Jacinta C. Nwachukwu",https://pureportal.coventry.ac.uk/en/publications/conditional-linkages-between-iron-ore-exports-foreign-aid-and-ter-2,Dec 2016
399,Connected Vehicles: Performance Convenience and Safety verses Security,Garikayi Madzudzo,https://pureportal.coventry.ac.uk/en/publications/connected-vehicles-performance-convenience-and-safety-verses-secu,1 Sep 2016
400,Connected Vehicles: Performance Convenience and Safety versus Security,Garikayi Madzudzo,https://pureportal.coventry.ac.uk/en/publications/connected-vehicles-performance-convenience-and-safety-versus-secu,1 Sep 2016
401,Detecting Bribery: A Guide for External Auditors,"Rasha Kassem, Andrew Higson",https://pureportal.coventry.ac.uk/en/publications/detecting-bribery-a-guide-for-external-auditors,Apr 2016
402,Economics and Political Implications of International Financial Reporting Standards,"E. Uchenna (Editor), M. Nnadi (Editor), Sailesh Tanna (Editor), F. Iyoha (Editor)",https://pureportal.coventry.ac.uk/en/publications/economics-and-political-implications-of-international-financial-r-2,Mar 2016
403,Entry strategies used by South African MNEs for FDI during turbulent times.,Tasneem Joosub,https://pureportal.coventry.ac.uk/en/publications/entry-strategies-used-by-south-african-mnes-for-fdi-during-turbul,2016
404,Equilibrium Interaction of Borrowing and Short-Sale Constraints and Asset Pricing,Nam Dau,https://pureportal.coventry.ac.uk/en/publications/equilibrium-interaction-of-borrowing-and-short-sale-constraints-a,2016
405,Equilibrium Interaction of Borrowing and Short-Sales Constraints and Asset Pricing,Nam Dau,https://pureportal.coventry.ac.uk/en/publications/equilibrium-interaction-of-borrowing-and-short-sales-constraints-,2016
406,External auditors and corporate corruption: Implications for audit regulators: Current Issues in Auditing Journal,"Rasha Kassem, Andrew Higson",https://pureportal.coventry.ac.uk/en/publications/external-auditors-and-corporate-corruption-implications-for-audit,Jun 2016
