,title,author_name,title_link,date
195,Corporate Governance in Ghana: An Analysis of Board Accountability in Ghanaian Listed Banks,"Larry Amartei Amartey, Mei Yu, Osita Chukwu-Iobelu",https://pureportal.coventry.ac.uk/en/publications/corporate-governance-in-ghana-an-analysis-of-board-accountability,13 May 2019
196,Corporate Social Responsibility: Consumer Perception For the UK Apparel Companies,"Juh Yan Tan, Mei Yu",https://pureportal.coventry.ac.uk/en/publications/corporate-social-responsibility-consumer-perception-for-the-uk-ap,2019
197,CSR-consumption paradox: Examination of UK apparel companies,"Mei Yu, Dongmei Cao, Juh Yan Tan",https://pureportal.coventry.ac.uk/en/publications/csr-consumption-paradox-examination-of-uk-apparel-companies,11 Mar 2019
198,Cyberattacks on critical infrastructure: an economic perspective,"Piotr Lis, Jacob Mendel",https://pureportal.coventry.ac.uk/en/publications/cyberattacks-on-critical-infrastructure-an-economic-perspective,Jun 2019
199,Data and Information Flows: Assessing Threads and Opportunities to Ensure Privacy and Investment Returns,Alessio Faccia,https://pureportal.coventry.ac.uk/en/publications/data-and-information-flows-assessing-threads-and-opportunities-to,28 Aug 2019
200,Discharging environmental accountability in emerging economies: Illustrations from Nigerian cement industry,"Abdurafiu Noah, Pik Liew, Pawan Adhikari",https://pureportal.coventry.ac.uk/en/publications/discharging-environmental-accountability-in-emerging-economies-il,12 May 2019
201,Do Compensation Consultants Drive Up CEO Pay? Evidence from UK Public Firms,"Martin J. Conyon, Lars, Helge Hass, Simon, I Peck, Graham Sadler, Zhifang Zhang",https://pureportal.coventry.ac.uk/en/publications/do-compensation-consultants-drive-up-ceo-pay-evidence-from-uk-pub,2019
202,"Do culture, sentiment, and cognitive dissonance explain the ‘above suspicion’ anomalies?","Ali Altanlar, Jiaqi Guo, Phil Holmes",https://pureportal.coventry.ac.uk/en/publications/do-culture-sentiment-and-cognitive-dissonance-explain-the-above-s,Nov 2019
203,Do disclosure and transparency affect bank’s financial performance?,Isaiah Oino,https://pureportal.coventry.ac.uk/en/publications/do-disclosure-and-transparency-affect-banks-financial-performance,2 Dec 2019
204,Does Accounting Treatment of Share-Based Payments Impact Performance Measures for Banks?,"Alaa Alhaj Ismail, Sami Adwan, John Stittle",https://pureportal.coventry.ac.uk/en/publications/does-accounting-treatment-of-share-based-payments-impact-performa,Dec 2019
205,Does corporate R&D investment affect firm environmental performance? Evidence from G-6 countries,"Md Samsul Alam, Muhammad Atif, Chu Chien-Chi, Uğur Soytaş",https://pureportal.coventry.ac.uk/en/publications/does-corporate-rampd-investment-affect-firm-environmental-perform,1 Feb 2019
206,Entrepreneurial Intent on Induction to Undergraduate Business Courses: A Comparison of Two Higher Education Institutions in the UK,"Pete McLuskie, Charlotte Carey, Kelly Smith, Tom Williamson, Susan Sisay",https://pureportal.coventry.ac.uk/en/publications/entrepreneurial-intent-on-induction-to-undergraduate-business-cou,14 Nov 2019
207,Essential Personal Finance:  A Practical Guide for Employees,"Jonquil Lowe, Jason Butler, Lien Luu",https://pureportal.coventry.ac.uk/en/publications/essential-personal-finance-a-practical-guide-for-employees,11 Jan 2019
208,Family-controlled      financial institutions: An institutional perspective on service quality management,"Abdurafiu Noah, Hassan Yasdifar, Babafemi Ogundele",https://pureportal.coventry.ac.uk/en/publications/family-controlled-financial-institutions-an-institutional-perspec,11 Jul 2019
209,Financial Accounting: Text and cases,"Alessio Faccia, Francesco Manni",https://pureportal.coventry.ac.uk/en/publications/financial-accounting-text-and-cases,1 Jan 2019
210,Forecasting Government Bond Spreads with Heuristic Models: Evidence from the Eurozone Periphery,"Filipa Da Silva Fernandes, Charalampos Stasinakis, Zivile Zekaite",https://pureportal.coventry.ac.uk/en/publications/forecasting-government-bond-spreads-with-heuristic-models-evidenc,Nov 2019
211,Human Capital and Exports: A Micro-level Analysis of Transition Countries,"Arta Mulliqi, Nick Adnett, Mehtap Hisarciklilar",https://pureportal.coventry.ac.uk/en/publications/human-capital-and-exports-a-micro-level-analysis-of-transition-co,3 Oct 2019
212,"ICT, Financial Sector Development and Financial Access","Simplice Asongu, Jacinta Nwachukwu",https://pureportal.coventry.ac.uk/en/publications/ict-financial-sector-development-and-financial-access,Jun 2019
213,Impulse balance and framing effects in threshold public good games,"Edward Cartwright, Anna Stepanova, Lian Xue",https://pureportal.coventry.ac.uk/en/publications/impulse-balance-and-framing-effects-in-threshold-public-good-game,1 Oct 2019
214,"Integrated cloud financial accounting cycle. How artificial intelligence, blockchain, and XBRL will change the accounting, fiscal and auditing practices","Alessio Faccia, Mohamed Yousif Khamis Al Naqbi, Saeed Ahmad Lootah",https://pureportal.coventry.ac.uk/en/publications/integrated-cloud-financial-accounting-cycle-how-artificial-intell,28 Aug 2019
215,Investing in Prevention or Paying for Recovery - Attitudes to Cyber Risk,"Anna Cartwright, Edward Cartwright, Lian Xue",https://pureportal.coventry.ac.uk/en/publications/investing-in-prevention-or-paying-for-recovery-attitudes-to-cyber,23 Oct 2019
216,Is the Language of Fraud Failing its Victims?,"Rasha Kassem, Mike Betts",https://pureportal.coventry.ac.uk/en/publications/is-the-language-of-fraud-failing-its-victims,1 May 2019
217,Learning dispositif and emotional attachment: a preliminary international investigation,"Simon Huston, Elena Huston, Marek Kozlowski",https://pureportal.coventry.ac.uk/en/publications/learning-dispositif-and-emotional-attachment-a-preliminary-intern,23 Nov 2019
218,"Loan Quality, Cost Efficiency, and Corporate Earnings in Islamic Banking","Sarkar Kabir, Md Hamid Uddin, Sabur Mollah",https://pureportal.coventry.ac.uk/en/publications/loan-quality-cost-efficiency-and-corporate-earnings-in-islamic-ba,2019
219,"Majoritarian Preference, Utilitarian Welfare and Public Information in Cournot Oligopoly","Jaideep Roy, Randy Silvers, Ching-Jen Sun",https://pureportal.coventry.ac.uk/en/publications/majoritarian-preference-utilitarian-welfare-and-public-informatio,Jul 2019
220,Measuring the Energy Input Substitution and Output Effects of Energy Price Changes and the Implications for the Environment,Akin Sharimakin,https://pureportal.coventry.ac.uk/en/publications/measuring-the-energy-input-substitution-and-output-effects-of-ene,1 Oct 2019
221,Mergers and Acquisitions: Implications for Acquirers’ Market Risk,"Sailesh Tanna, Ibrahim Yousef",https://pureportal.coventry.ac.uk/en/publications/mergers-and-acquisitions-implications-for-acquirers-market-risk,8 Apr 2019
222,Multi Academy Trusts in England: A scenario of cooperation with universities,"H.K. Massoud, R.M. Ayoubi, M. Loutfi",https://pureportal.coventry.ac.uk/en/publications/multi-academy-trusts-in-england-a-scenario-of-cooperation-with-un,7 May 2019
223,New Approaches in Assessing CSR & Sustainability Disclosure: Insights into the Updateability of Web-based Data,Tariq Al Montaser,https://pureportal.coventry.ac.uk/en/publications/new-approaches-in-assessing-csr-amp-sustainability-disclosure-ins,9 Apr 2019
224,Political ideology and NGO accountability: the case of the Syrian conflict,"Mohammed Al Mahameed, Ahmad Abras",https://pureportal.coventry.ac.uk/en/publications/political-ideology-and-ngo-accountability-the-case-of-the-syrian-,2019
225,Psychopathic Traits of Corporate Leadership as Predictors of Future Stock Returns,"Ayman Omar, Tomasz Piotr Wisniewski, Sina Yekini",https://pureportal.coventry.ac.uk/en/publications/psychopathic-traits-of-corporate-leadership-as-predictors-of-futu,Nov 2019
226,Ransomware and reputation,"Anna Cartwright, Edward Cartwright",https://pureportal.coventry.ac.uk/en/publications/ransomware-and-reputation,10 Jun 2019
227,Real exchange rate and asymmetric shocks in the West African Monetary Zone (WAMZ),"Raymond Adu, Ioannis Litsios, Mark Baimbridge",https://pureportal.coventry.ac.uk/en/publications/real-exchange-rate-and-asymmetric-shocks-in-the-west-african-mone,Mar 2019
228,Report of the Key Development Needs (KDNs) Assessment Exercise by the State of Osun's Citizens for Improved Governance and Better Service Delivery,"Ejike Udeogu, Uzochukwu Amakom",https://pureportal.coventry.ac.uk/en/publications/report-of-the-key-development-needs-kdns-assessment-exercise-by-t,2019
229,Risk aversion and beta anomaly (with Peng Li),Jiaqi Guo,https://pureportal.coventry.ac.uk/en/publications/risk-aversion-and-beta-anomaly-with-peng-li,2019
230,"Share-Option Based Compensation Expense, Shareholder Returns and Financial Crisis","Alaa Alhaj Ismail, Sami Adwan, John Stittle",https://pureportal.coventry.ac.uk/en/publications/share-option-based-compensation-expense-shareholder-returns-and-f,Apr 2019
231,Shari’ah Governance of Islami Bank Bangladesh Limited: Implications of Ownership Change,"Hafij Ullah, Ruma Khanam",https://pureportal.coventry.ac.uk/en/publications/shariah-governance-of-islami-bank-bangladesh-limited-implications,29 May 2019
232,Stress Testing and Reverse Stress Testing: An Approach for a Resilient Islamic Financial Industry,Samir Alamad,https://pureportal.coventry.ac.uk/en/publications/stress-testing-and-reverse-stress-testing-an-approach-for-a-resil,2019
233,"Tax Evasion, Information Systems and Blockchain","Alessio Faccia, Narcisa Roxana Mosteanu",https://pureportal.coventry.ac.uk/en/publications/tax-evasion-information-systems-and-blockchain,1 May 2019
234,The dark side of transparency: Does the Nigeria extractive industries transparency initiative help or hinder accountability and corruption control?,"Amanze Ejiogu, Chibuzo Ejiogu, Ambisisi Ambituuni",https://pureportal.coventry.ac.uk/en/publications/the-dark-side-of-transparency-does-the-nigeria-extractive-industr,Sep 2019
235,The Effects of Corporate Social Responsibility on Real and Accrual‐based Earnings Management: Evidence from China,"Sang Ho Kim, Prabhu Udawatte,  Juelin Yin",https://pureportal.coventry.ac.uk/en/publications/the-effects-of-corporate-social-responsibility-on-real-and-accrua,Sep 2019
236,The hegemony in transfer pricing practices: The case of a Chinese organisation,Junyuan Chen,https://pureportal.coventry.ac.uk/en/publications/the-hegemony-in-transfer-pricing-practices-the-case-of-a-chinese-,2019
237,The impact of foreign direct investment on productivity: New evidence for developing countries,"Chengchun Li, Sailesh Tanna",https://pureportal.coventry.ac.uk/en/publications/the-impact-of-foreign-direct-investment-on-productivity-new-evide,1 Aug 2019
238,"The Impact of Trade Intensity and Market Characteristics on Asymmetric Volatility, Spillovers and Asymmetric Spillovers: Evidence from the Response of International Stock Markets to US Shocks","Mohammad Khaleq Newaz, Jin Suk Park",https://pureportal.coventry.ac.uk/en/publications/the-impact-of-trade-intensity-and-market-characteristics-on-asymm,Feb 2019
239,The islamic perspective of CSR in the Financial institutions in Nigeria: The case of Jaiz bank,"Abdurafiu Noah, Alim Abubakre",https://pureportal.coventry.ac.uk/en/publications/the-islamic-perspective-of-csr-in-the-financial-institutions-in-n,31 Jan 2019
240,The newest intelligent financial decisions tool: fractals. A smart approach to assess the risk,"Alessio Faccia, Narcisa Roxana Mosteanu",https://pureportal.coventry.ac.uk/en/publications/the-newest-intelligent-financial-decisions-tool-fractals-a-smart-,1 May 2019
241,The Role of Openness in the Effect of ICT on Governance,"Simplice Asongu, Jacinta Nwachukwu",https://pureportal.coventry.ac.uk/en/publications/the-role-of-openness-in-the-effect-of-ict-on-governance,3 Jul 2019
242,To pay or not: game theoretic models of ransomware,"Edward Cartwright, Julio Hernandez-Castro, Anna Cartwright",https://pureportal.coventry.ac.uk/en/publications/to-pay-or-not-game-theoretic-models-of-ransomware,2019
243,Towards a Sustainable University Led Support System for MSMEs,"Tom Williamson, Joan Lockyer",https://pureportal.coventry.ac.uk/en/publications/towards-a-sustainable-university-led-support-system-for-msmes,14 Nov 2019
244,To what extent do public and private financing sources affect access and quality of health care? Experiences from Uganda’s healthcare system,"Judith Kabajulizi, Qiaoyuan Lin, Fred Matovu",https://pureportal.coventry.ac.uk/en/publications/to-what-extent-do-public-and-private-financing-sources-affect-acc,30 Dec 2019
245,Understanding Financial Reporting Fraud in Egypt: Evidence from the Audit Field,Rasha Kassem,https://pureportal.coventry.ac.uk/en/publications/understanding-financial-reporting-fraud-in-egypt-evidence-from-th,2 Nov 2019
246,Understanding the Nature of Accounts Using Comprehensive Tools to Understand Financial Statements,"Alessio Faccia, D. Mosco",https://pureportal.coventry.ac.uk/en/publications/understanding-the-nature-of-accounts-using-comprehensive-tools-to,4 Oct 2019
247,Understanding time-inconsistent heterogeneous preferences in economics and finance: A practice theory approach,"Panos Andrikopoulos, Nick Webber",https://pureportal.coventry.ac.uk/en/publications/understanding-time-inconsistent-heterogeneous-preferences-in-econ,Nov 2019
248,VAT – different approach in Europe and GCC – a comparative analysis,"Alessio Faccia, Narcisa Roxana Mosteanu",https://pureportal.coventry.ac.uk/en/publications/vat-different-approach-in-europe-and-gcc-a-comparative-analysis,1 Mar 2019
249,What Matters in the Assessment of Financial Reporting Fraud Risk?,Rasha Kassem,https://pureportal.coventry.ac.uk/en/publications/what-matters-in-the-assessment-of-financial-reporting-fraud-risk-2,5 Jun 2019
250,"Agency costs, Ownership Structure and Corporate Governance Mechanisms in Ghana","Andrews Owusu, Charlie Weir",https://pureportal.coventry.ac.uk/en/publications/agency-costs-ownership-structure-and-corporate-governance-mechani,2018
251,Are single stock futures used as an alternative during a short-selling ban?,"Bouchra Benzennou, Owain ap Gwilym, Gwion Williams",https://pureportal.coventry.ac.uk/en/publications/are-single-stock-futures-used-as-an-alternative-during-a-short-se,Jan 2018
252,Assessing Management Integrity: Insights from Big 4 Auditors in Egypt,Rasha Kassem,https://pureportal.coventry.ac.uk/en/publications/assessing-management-integrity-insights-from-big-4-auditors-in-eg,1 Jul 2018
253,"Bank Size, Information Sharing and Financial Access in Africa","Jacinta Nwachukwu, Simplice Asongu",https://pureportal.coventry.ac.uk/en/publications/bank-size-information-sharing-and-financial-access-in-africa,2018
254,Brexit – An Opportunity for Real Estate Firms in Germany and Ireland?,Rene Kumsta,https://pureportal.coventry.ac.uk/en/publications/brexit-an-opportunity-for-real-estate-firms-in-germany-and-irelan,2018
255,Cash Holdings and Corporate Investment Valuations: Evidence from The London Stock Exchange,"Edward Jones, Hao Li, Oluwagbenga Adamolekun",https://pureportal.coventry.ac.uk/en/publications/cash-holdings-and-corporate-investment-valuations-evidence-from-t-2,Jun 2018
256,Cash Holdings and Corporate Investment Valuations: Evidence from The London Stock Exchange,"Oluwagbenga Adamolekun, Edward Jones, Hao Li",https://pureportal.coventry.ac.uk/en/publications/cash-holdings-and-corporate-investment-valuations-evidence-from-t,1 Jan 2018
257,Cash Holdings and Corporate Investment Valuations: Evidence from UK Corporate Investment Announcement,Oluwagbenga Adamolekun,https://pureportal.coventry.ac.uk/en/publications/cash-holdings-and-corporate-investment-valuations-evidence-from-u,13 Aug 2018
258,Cash Holdings and Firm Competitiveness,"Oluwagbenga Adamolekun, Hao Li, Edward Jones",https://pureportal.coventry.ac.uk/en/publications/cash-holdings-and-firm-competitiveness,1 Jan 2018
259,Common Biases In Business Research,"Hiba Massoud, Sulaiman Mouselli",https://pureportal.coventry.ac.uk/en/publications/common-biases-in-business-research,2018
260,Comparative compliance status of AAOIFI and IFSB standards: An empirical evidence from Islami Bank Bangladesh Limited,"Hafij Ullah, Ruma Khanam, Tabassum Tasnim",https://pureportal.coventry.ac.uk/en/publications/comparative-compliance-status-of-aaoifi-and-ifsb-standards-an-emp,5 Jun 2018
261,Comparative Human Development Thresholds for Absolute and Relative Pro-poor Mobile Banking in Developing Countries,"Simplice Asongu, Jacinta Nwachukwu",https://pureportal.coventry.ac.uk/en/publications/comparative-human-development-thresholds-for-absolute-and-relativ,5 Feb 2018
262,Competing Institutional Logics in Islamic Financial Reporting Standardisation: A Comparative Study ,Ahmad Abras,https://pureportal.coventry.ac.uk/en/publications/competing-institutional-logics-in-islamic-financial-reporting-sta,2018
263,Corporate Governance and Audit Quality: Further Recommendations Beyond the Code,Salem Alhababsah,https://pureportal.coventry.ac.uk/en/publications/corporate-governance-and-audit-quality-further-recommendations-be,26 Jan 2018
264,Corporate Governance Practices in Jordan,Salem Alhababsah,https://pureportal.coventry.ac.uk/en/publications/corporate-governance-practices-in-jordan,2018
265,Determinants of Mobile Phone Penetration: Panel Threshold Evidence from Sub-Saharan Africa,"Simplice Asongu, Jacinta Nwachukwu, Aqsa Aziz",https://pureportal.coventry.ac.uk/en/publications/determinants-of-mobile-phone-penetration-panel-threshold-evidence,2018
266,Does Size Matter in Predicting SMEs Failure?,"Jayraj Gupta, Mariachiara Barzotto, Amir Khorasgani",https://pureportal.coventry.ac.uk/en/publications/does-size-matter-in-predicting-smes-failure,Oct 2018
267,Does the crowd mean business? An analysis of rewards-based crowdfunding as a source of finance for start-ups and small businesses,"Joe Cox, Thang Nguyen",https://pureportal.coventry.ac.uk/en/publications/does-the-crowd-mean-business-an-analysis-of-rewards-based-crowdfu,2018
268,Do terrorist attacks harm financial markets? A meta-analysis of event studies and the determinants of adverse impact,"Jin Suk Park, Mohammad Khaleq Newaz",https://pureportal.coventry.ac.uk/en/publications/do-terrorist-attacks-harm-financial-markets-a-meta-analysis-of-ev,Aug 2018
269,Effects of asymmetric information on market timing in the mutual fund industry,"Jacinta Nwachukwu, Vanessa S Tchamyou, Simplice Asongu",https://pureportal.coventry.ac.uk/en/publications/effects-of-asymmetric-information-on-market-timing-in-the-mutual-,8 Oct 2018
270,Enhancing nurse satisfaction: an exploration of specialty nurse shortage within the West Midlands region of NHS England Nursing Management,"Karl Shutes, Keith Gray, Rebecca Wilde",https://pureportal.coventry.ac.uk/en/publications/enhancing-nurse-satisfaction-an-exploration-of-specialty-nurse-sh,22 Mar 2018
271,Environmental Regulation And International Competitiveness: A Critical Review,Abay Mulatu,https://pureportal.coventry.ac.uk/en/publications/environmental-regulation-and-international-competitiveness-a-crit,2018
272,"Fatality Sensitivity: Factors shaping British, Polish and Australian public opinion on the Iraq war",Piotr Lis,https://pureportal.coventry.ac.uk/en/publications/fatality-sensitivity-factors-shaping-british-polish-and-australia,28 Mar 2018
273,FDI Spillover Effects in China’s Manufacturing Sector: New Evidence from Forward and Backward Linkages,"Chengchun Li, Sailesh Tanna",https://pureportal.coventry.ac.uk/en/publications/fdi-spillover-effects-in-chinas-manufacturing-sector-new-evidence,18 Apr 2018
274,Fighting Terrorism: Empirics on Policy Harmonisation,"Simplice Asongu, Jacinta Nwachukwu",https://pureportal.coventry.ac.uk/en/publications/fighting-terrorism-empirics-on-policy-harmonisation,Aug 2018
275,"Financialisation, Capital Accumulation and Economic Development in Nigeria: A critical perspective. ",Ejike Udeogu,https://pureportal.coventry.ac.uk/en/publications/financialisation-capital-accumulation-and-economic-development-in,4 Jul 2018
276,Fundamental Analysis According to the F-Score Method in the German Stock Market,Rene Kumsta,https://pureportal.coventry.ac.uk/en/publications/fundamental-analysis-according-to-the-f-score-method-in-the-germa,8 May 2018
277,Impact of Corporate Governance on Bank Financial Performance,"Isaiah Oino, Mohammed Itan",https://pureportal.coventry.ac.uk/en/publications/impact-of-corporate-governance-on-bank-financial-performance,Aug 2018
278,Impact Of Regulatory Capital On European Banks Financial Performance: A Review Of Post Global Financial Crisis,Isaiah Oino,https://pureportal.coventry.ac.uk/en/publications/impact-of-regulatory-capital-on-european-banks-financial-performa,Apr 2018
279,Increasing Foreign Aid for Inclusive Human Development in Africa,"Simplice Asongu, Jacinta Nwachukwu",https://pureportal.coventry.ac.uk/en/publications/increasing-foreign-aid-for-inclusive-human-development-in-africa,Jul 2018
280,Institutional change and corporate governance diversity in China’s SOEs,"Da Teng, Fuller Douglas, Chengchun Li",https://pureportal.coventry.ac.uk/en/publications/institutional-change-and-corporate-governance-diversity-in-chinas,2018
281,Is information diffusion a threat to market power for financial access? Insights from the African banking industry,"Simplice Asongu, Enowbi Batuo, Jacinta Nwachukwu, Vanessa Tchamyou",https://pureportal.coventry.ac.uk/en/publications/is-information-diffusion-a-threat-to-market-power-for-financial-a,Jun 2018
282,"Large Market Games, the Law of One Price, and Market Structure",Waseem Toraubally,https://pureportal.coventry.ac.uk/en/publications/large-market-games-the-law-of-one-price-and-market-structure,Oct 2018
283,Leadership Styles and Job Satisfaction,"Isaiah Oino, Saima Asghar",https://pureportal.coventry.ac.uk/en/publications/leadership-styles-and-job-satisfaction,23 Jul 2018
284,Learnings from Japan: An EEUK Mission,Tom Williamson,https://pureportal.coventry.ac.uk/en/publications/learnings-from-japan-an-eeuk-mission,5 Sep 2018
285,Lessons from a Survey of China’s  Economic Diplomacy,"Jacinta Nwachukwu, Simplice Asongu, Gilbert Aminkeng",https://pureportal.coventry.ac.uk/en/publications/lessons-from-a-survey-of-chinas-economic-diplomacy,Sep 2018
286,"Mobile phones, institutional quality and entrepreneurship in Sub-Saharan Africa","Simplice Asongu, Stella-Maris Orim, Jacinta Nwachukwu",https://pureportal.coventry.ac.uk/en/publications/mobile-phones-institutional-quality-and-entrepreneurship-in-sub-s,Jun 2018
287,"Openness, ICT and Entrepreneurship in Sub-Saharan Africa","Jacinta Nwachukwu, Simplice Asongu",https://pureportal.coventry.ac.uk/en/publications/openness-ict-and-entrepreneurship-in-sub-saharan-africa,2018
288,PhD by Publication as an Argument for Innovation and Technology Transfer: with Emphasis on Africa,"Jacinta Nwachukwu, Simplice Asongu",https://pureportal.coventry.ac.uk/en/publications/phd-by-publication-as-an-argument-for-innovation-and-technology-t,3 Jan 2018
289,Political Regimes and Stock Market Performance in Africa,"S. Asongu, Jacinta Nwachukwu",https://pureportal.coventry.ac.uk/en/publications/political-regimes-and-stock-market-performance-in-africa,Aug 2018
290,Predicting Unlisted SMEs' Default: Incorporating Market Information on Accounting-based Models for Improved Accuracy,"Panos Andrikopoulos, Amir Khorasgani",https://pureportal.coventry.ac.uk/en/publications/predicting-unlisted-smes-default-incorporating-market-information,Sep 2018
291,Pulling effect of Colonial Legacies on Africa’s Inward FDI,"Maktoba Omar, Collins Osei, Suliman Joosub",https://pureportal.coventry.ac.uk/en/publications/pulling-effect-of-colonial-legacies-on-africas-inward-fdi,5 Sep 2018
292,Revisiting the evidence of earnings management prior to merger announcements: an application of Benford’s law,"Thai Nguyen, Hanh Thi My Le (Editor), Nguyet Nguyen (Editor), Chau Duong (Editor)",https://pureportal.coventry.ac.uk/en/publications/revisiting-the-evidence-of-earnings-management-prior-to-merger-an,26 Dec 2018
293,Risks Associated with Payment Banks and Mobile-Based Money Platforms,"Hafiz Ubaid Ur Rahman Rahmani, Barjoyai Bardai, Abdoulrahman Aljounaidi Mhd Ramez",https://pureportal.coventry.ac.uk/en/publications/risks-associated-with-payment-banks-and-mobile-based-money-platfo,20 Nov 2018
294,Self-determination and service performance: the roles of service adaptiveness and openness to experience,"Weiyue Wang, Hongwei He, Sunil Sahadev, Wei Song",https://pureportal.coventry.ac.uk/en/publications/self-determination-and-service-performance-the-roles-of-service-a,14 Jun 2018
295,Socially Responsible Investment,"Audrey Paterson, Mohamed Elshinawy, Oluwagbenga Adamolekun,  Stephen Rae, Mohamed Sherif",https://pureportal.coventry.ac.uk/en/publications/socially-responsible-investment,Jan 2018
296,Sukuk as a Financial Asset: A Review,"Mohammed Hossain, Hamid Uddin, Sarkar Kabir",https://pureportal.coventry.ac.uk/en/publications/sukuk-as-a-financial-asset-a-review,2018
297,Sustainable management of affordable housing,"Simon Huston, Richard Baines",https://pureportal.coventry.ac.uk/en/publications/sustainable-management-of-affordable-housing,15 Nov 2018
298,"Temporal Stability of Groundwater Depth in the Contemporary Yellow River Delta, Eastern China","Ruiyan Wang, Simon Huston, Yuhuan Li, Huiping Ma, Yang Peng, Lihua Ding",https://pureportal.coventry.ac.uk/en/publications/temporal-stability-of-groundwater-depth-in-the-contemporary-yello,28 Jun 2018
299,"The Determinants Of Interest Rates In Microfinance: Age, Scale And Organisational Charter","Jacinta Nwachukwu, Aqsa Aziz, Uchenna Tony-Okeke, Simplice Asongu",https://pureportal.coventry.ac.uk/en/publications/the-determinants-of-interest-rates-in-micro-banks-age-and-scale,Aug 2018
